{"$defs":{"checklist_item":{"additionalProperties":false,"properties":{"evidence":{"$ref":"#/$defs/evidence"},"external_acceptance_required":{"type":"boolean"},"local_status":{"type":"string"},"stage":{"type":"string"}},"required":["stage","evidence","external_acceptance_required","local_status"],"type":"object"},"evidence":{"additionalProperties":false,"properties":{"evidence_class":{"type":"string"},"harness_command":{"type":"string"},"path":{"type":"string"},"selector":{"type":"string"},"sha256":{"pattern":"^[0-9a-f]{64}$","type":"string"}},"required":["path","selector","sha256","evidence_class","harness_command"],"type":"object"},"reference":{"additionalProperties":false,"properties":{"path":{"type":"string"},"selector":{"type":"string"},"sha256":{"pattern":"^[0-9a-f]{64}$","type":"string"}},"required":["path","selector","sha256"],"type":"object"},"target":{"additionalProperties":false,"properties":{"artifact":{"type":"string"},"certification":{"const":"not-asserted"},"runner":{"type":"string"},"target":{"type":"string"}},"required":["target","artifact","runner","certification"],"type":"object"}},"$id":"https://leanctx.dev/contracts/delivery-evidence-v1.schema.json","$schema":"https://json-schema.org/draft/2020-12/schema","additionalProperties":false,"properties":{"checklist":{"items":{"$ref":"#/$defs/checklist_item"},"type":"array"},"delivery_manifest":{"additionalProperties":false,"properties":{"fixture":{"$ref":"#/$defs/reference"},"schema":{"$ref":"#/$defs/reference"},"trust_root":{"$ref":"#/$defs/reference"},"verifier":{"$ref":"#/$defs/reference"}},"required":["fixture","schema","trust_root","verifier"],"type":"object"},"owner":{"additionalProperties":false,"properties":{"handle":{"const":"@yvgude"},"source":{"$ref":"#/$defs/reference"}},"required":["handle","source"],"type":"object"},"release":{"additionalProperties":false,"properties":{"publish_channels":{"items":{"additionalProperties":false,"properties":{"id":{"type":"string"},"source_path":{"type":"string"},"source_sha256":{"pattern":"^[0-9a-f]{64}$","type":"string"},"trigger_pattern":{"type":"string"}},"required":["id","source_path","source_sha256","trigger_pattern"],"type":"object"},"type":"array"},"targets":{"items":{"$ref":"#/$defs/target"},"type":"array"},"version_gates":{"items":{"additionalProperties":false,"properties":{"id":{"type":"string"},"source":{"$ref":"#/$defs/reference"},"workflow_selector":{"type":"string"}},"required":["id","source","workflow_selector"],"type":"object"},"type":"array"},"workflow":{"$ref":"#/$defs/reference"},"workflow_tag_glob":{"const":"v[0-9]*"}},"required":["workflow","workflow_tag_glob","publish_channels","targets","version_gates"],"type":"object"},"requirement_ids":{"items":{"type":"string"},"type":"array"},"schema_version":{"const":"leanctx.delivery-evidence/v1"},"scope":{"additionalProperties":false,"properties":{"customer_delivery_acceptance":{"type":"boolean"},"external_operational_acceptance":{"type":"boolean"},"local_contract_consistency":{"type":"boolean"},"os_certification":{"type":"boolean"},"zero_downtime_verified":{"type":"boolean"}},"required":["local_contract_consistency","customer_delivery_acceptance","external_operational_acceptance","os_certification","zero_downtime_verified"],"type":"object"},"status":{"const":"partial"}},"required":["schema_version","status","requirement_ids","scope","owner","checklist","delivery_manifest","release"],"type":"object"}
